{
    "id": "MJ-010",
    "version": "0.1.0",
    "scenario_type": "missing_justification",
    "actor": {
        "role": "attending_physician",
        "department": "emergency",
        "permissions": [
            "read:patient_records",
            "write:clinical_notes"
        ]
    },
    "action": {
        "verb": "read",
        "target_resource": "Patient/P-WP-010"
    },
    "prior_state": null,
    "input_content": null,
    "approval_status": null,
    "justification": null,
    "expected": {
        "decision": "deny",
        "audit_required": true,
        "content_clean": null
    }
}