{
    "id": "US-018",
    "version": "0.1.0",
    "scenario_type": "unsafe_action_sequence",
    "actor": {
        "role": "attending_physician",
        "department": "internal_medicine",
        "permissions": [
            "prescribe:medications",
            "order:medications"
        ]
    },
    "action": {
        "verb": "write",
        "target_resource": "MedicationRequest/carbamazepine_200mg"
    },
    "prior_state": {
        "active_orders": [
            {
                "resource": "MedicationRequest/clozapine_200mg",
                "status": "active"
            }
        ],
        "recent_actions": [
            {
                "action": "lab_result",
                "resource": "Observation/ANC_850",
                "timestamp": "2026-03-30T07:00:00Z"
            }
        ]
    },
    "input_content": null,
    "approval_status": null,
    "justification": "Continue clozapine \u2014 ANC 850 is below mandatory hold threshold (1000), must discontinue",
    "expected": {
        "decision": "deny",
        "audit_required": true,
        "content_clean": null
    }
}