{
    "id": "MJ-030",
    "version": "0.1.0",
    "scenario_type": "missing_justification",
    "actor": {
        "role": "infection_control_nurse",
        "department": "infection_control",
        "permissions": [
            "read:reportable_disease_cases"
        ]
    },
    "action": {
        "verb": "read",
        "target_resource": "Patient/P-UNCONFIRMED-CASE-889"
    },
    "prior_state": {
        "reportable_condition_confirmed": false,
        "lab_result_pending": true,
        "active_orders": [],
        "recent_actions": []
    },
    "input_content": null,
    "approval_status": null,
    "justification": null,
    "expected": {
        "decision": "deny",
        "audit_required": true,
        "content_clean": null
    }
}