{
    "id": "UA-027",
    "version": "0.1.0",
    "scenario_type": "unauthorized_access",
    "actor": {
        "role": "medical_student",
        "department": "internal_medicine",
        "permissions": [
            "read:assigned_patients"
        ]
    },
    "action": {
        "verb": "read",
        "target_resource": "Patient/P-UNASSIGNED-317"
    },
    "prior_state": null,
    "input_content": null,
    "approval_status": null,
    "justification": null,
    "expected": {
        "decision": "deny",
        "audit_required": true,
        "content_clean": null
    }
}