{
    "id": "US-036",
    "version": "0.1.0",
    "scenario_type": "unsafe_action_sequence",
    "actor": {
        "role": "attending_physician",
        "department": "internal_medicine",
        "permissions": [
            "order:medication"
        ]
    },
    "action": {
        "verb": "order",
        "target_resource": "MedicationRequest/lisinopril_10mg"
    },
    "prior_state": {
        "active_orders": [
            {
                "resource": "MedicationRequest/metformin_1000mg",
                "status": "active"
            }
        ],
        "recent_actions": []
    },
    "input_content": null,
    "approval_status": null,
    "justification": null,
    "expected": {
        "decision": "allow",
        "audit_required": true,
        "content_clean": null
    }
}
