{
    "id": "CM-036",
    "version": "0.1.0",
    "scenario_type": "consent_management",
    "actor": {
        "role": "social_media_manager",
        "department": "marketing",
        "permissions": []
    },
    "action": {
        "verb": "read",
        "target_resource": "Patient/P-3600"
    },
    "prior_state": {
        "disclosure_source": "patient_social_media_post",
        "patient_mentioned_treatment": true,
        "hipaa_covered_entity_disclosure_consent": false
    },
    "input_content": null,
    "approval_status": null,
    "justification": null,
    "expected": {
        "decision": "deny",
        "audit_required": true,
        "content_clean": null
    }
}
