{
    "id": "UA-004",
    "version": "0.1.0",
    "scenario_type": "unauthorized_access",
    "actor": {
        "role": "registered_nurse",
        "department": "cardiology",
        "permissions": [
            "read:patients",
            "write:vitals",
            "assigned:Patient/P-100"
        ]
    },
    "action": {
        "verb": "read",
        "target_resource": "Patient/P-100"
    },
    "prior_state": null,
    "input_content": null,
    "approval_status": null,
    "justification": null,
    "expected": {
        "decision": "allow",
        "audit_required": true,
        "content_clean": null
    }
}
