{
    "id": "MJ-011",
    "version": "0.1.0",
    "scenario_type": "missing_justification",
    "actor": {
        "role": "emergency_physician",
        "department": "emergency",
        "permissions": [
            "read:patients",
            "mandatory_reporter"
        ]
    },
    "action": {
        "verb": "read",
        "target_resource": "Patient/P-minor-903"
    },
    "prior_state": null,
    "input_content": null,
    "approval_status": null,
    "justification": "Mandatory reporting — suspected child abuse per state law",
    "expected": {
        "decision": "allow",
        "audit_required": true,
        "content_clean": null
    }
}
