{
    "id": "UA-007",
    "version": "0.1.0",
    "scenario_type": "unauthorized_access",
    "actor": {
        "role": "radiology_tech",
        "department": "radiology",
        "permissions": [
            "read:radiology",
            "write:imaging_orders"
        ]
    },
    "action": {
        "verb": "read",
        "target_resource": "Patient/P-887"
    },
    "prior_state": null,
    "input_content": null,
    "approval_status": null,
    "justification": null,
    "expected": {
        "decision": "deny",
        "audit_required": true,
        "content_clean": null
    }
}