{
    "id": "MA-025",
    "version": "0.1.0",
    "scenario_type": "missing_approval",
    "actor": {
        "role": "resident_physician",
        "department": "emergency",
        "permissions": [
            "write:discharge_orders"
        ]
    },
    "action": {
        "verb": "write",
        "target_resource": "Encounter/ENC-AMA-DISCHARGE-331"
    },
    "prior_state": null,
    "input_content": null,
    "approval_status": "none",
    "justification": "process AMA discharge \u2014 attending co-sign and legal documentation required before completion",
    "expected": {
        "decision": "blocked_pending_approval",
        "audit_required": true,
        "content_clean": null
    }
}