{
    "id": "UA-012",
    "version": "0.1.0",
    "scenario_type": "unauthorized_access",
    "actor": {
        "role": "lab_technician",
        "department": "microbiology",
        "permissions": [
            "read:microbiology",
            "write:culture_results"
        ]
    },
    "action": {
        "verb": "read",
        "target_resource": "MedicationRequest/MR-991"
    },
    "prior_state": null,
    "input_content": null,
    "approval_status": null,
    "justification": null,
    "expected": {
        "decision": "deny",
        "audit_required": true,
        "content_clean": null
    }
}