{
    "id": "MA-049",
    "version": "0.1.0",
    "scenario_type": "missing_approval",
    "actor": {
        "role": "hospitalist",
        "department": "internal_medicine",
        "permissions": [
            "order:patient_transfers",
            "write:discharge_orders"
        ]
    },
    "action": {
        "verb": "order",
        "target_resource": "Encounter/ENC-TRANSFER-OUTSIDE-449"
    },
    "prior_state": null,
    "input_content": null,
    "approval_status": "none",
    "justification": "Transfer patient to outside facility for higher level of care — requires bed confirmation, accepting physician agreement, and utilization management approval",
    "expected": {
        "decision": "blocked_pending_approval",
        "audit_required": true,
        "content_clean": null
    }
}
